27,How confident are you that changes in Current residents' interests lead to changes in Support for Upzoning? Does it have a positive effect (increasing it) or a negative effect (decreasing it)? How strong is this effect?,I mean I feel like if current residents had less things to strive for or hope for or changes that they would need then perhaps it would be easier to accept upzoning. I think that's what I meant by that current residents interest is solving the current issues is necessary before we add more people to an area that's already dysfunctional or a city that's already dysfunctional. Things needs to be in a stable place before adding even more instability to it. So I would say it has a pretty strong effect because content people are more likely to accept change than people who are already having a hard time or are already angry about something.
28,How would you describe the relationship between Right to Shelter and Support for Upzoning? Is it a strong or weak connection? Does it have a positive effect (increasing it) or a negative effect (decreasing it)? How strong is this effect?,"Oh, it's an extremely strong connection. Every human being has a right to live. They have a right to shelter. They have a right to water. They have a right to food. They have a right to survive, a right to electricity, a right to warmth, a right to the internet these days with the way things work. Everyone has their basic human rights. And of course, giving people a place to live is important. I would say that would have a positive effect on the idea of upzoning because it's the only big benefit that I could see and I'm sure a lot of people could see is it would give people who can't afford a place to live and make affording to live easier for people who are struggling. So it's a very strong effect. It's the one big positive that exists in all this."
29,"Does Negative effects on population and economy have a positive or negative effect on Support for Upzoning, and how significant is this effect? Does it have a positive effect (increasing it) or a negative effect (decreasing it)? How strong is this effect?","that this question answers itself. Do negative effects on population and economy have a positive or negative effect on support? Well, there are negative effects. So of course, they have a negative effect. I think that this is an extended question that didn't really come out quite right, or maybe wasn't necessary to ask because this is already, it answers itself."
30,How confident are you that changes in Older residents lead to changes in Support for Upzoning? Does it have a positive effect (increasing it) or a negative effect (decreasing it)? How strong is this effect?,"I don't really understand what changes in older residence means. I mean, I feel like as long as areas where, if already pre-established areas where lots of people who have been living here for a long time live remain untouched, that might lead to more support. But if negative changes happen to them, if things change in their lives and there's more chaos and change added to it, then that would be a negative effect. And it would be pretty strong either way. So again, not a super clear question, but that's the answer I think I can give."
31,"Is the effect of School capacity on Support for Upzoning immediate, or does it take time to develop? Does it have a positive effect (increasing it) or a negative effect (decreasing it)? How strong is this effect?","Oh, this is for sure an immediate concern. Schools are already really full and there are not enough teachers generally all over the nation. So it's very hard already to deal with how many kids are in so many schools that already exist here. Adding even more to a certain area would totally overflow the school system. Like there would be no way to give attention to the kids who need it. There would be no way to have enough teachers. The classes are already so big, the sizes of the classes, I mean. And it would be immediate, especially if many people move in all at once. It would be a very negative effect. And I would say it's pretty strong. And this would be detrimental to both angry parents and kids who are not getting a proper education to begin with. It's such a poor school system already. Adding even more weights to something that's breaking is not going to be efficient or effective or good."
32,"What do you think are the main causes of Single-family neighborhoods, and how certain are you about these relationships? Please also indicate if these influences are positive (increasing) or negative (decreasing).","I don't really understand this question either. The main cause of single-family neighborhoods are just that they were already pre-established to begin with. In the past, homes used to be affordable, so it made sense to live the typical quote-unquote American dream and get your white picket fence little home with a single earner earning all the income for a family and being able to support a family of four on just one income. That's not possible anymore. So I would say that the cause of single-family neighborhoods is a time before everything was as ridiculously priced as it is now. It's not feasible anymore, but it used to be at least somewhat feasible in the past. Now it's basically impossible to be able to do that. So the cause of it is just it's pre-established. It already existed decades and decades ago. I would say that these influences just are. I don't think it's a positive or negative influence on cities. I think that it's nice to have areas like that. It's certainly incredibly expensive to live there, and rent is impossible to afford there, but I don't think that adding to those neighborhoods something that will decrease them in value is beneficial to anybody. Transcribed by https://otter.ai"